[
  {
    "id": "lng_communication_001",
    "word": "ačiū",
    "translations": {
      "en": "thanks",
      "ru": "спасибо"
    },
    "pos": "interjection",
    "category": "communication",
    "level": "A1",
    "source": "Langas"
  },
  {
    "id": "lng_food_001",
    "word": "agurkas",
    "translations": {
      "en": "cucumber",
      "ru": "огурец"
    },
    "pos": "noun",
    "gender": "masculine",
    "category": "food",
    "level": "A1",
    "source": "Langas"
  },
  {
    "id": "lng_city_001",
    "word": "aikštė",
    "translations": {
      "en": "square",
      "ru": "площадь"
    },
    "pos": "noun",
    "gender": "feminine",
    "category": "city",
    "level": "A1",
    "source": "Langas"
  },
  {
    "id": "lng_everyday_001",
    "word": "akiniai",
    "translations": {
      "en": "glasses",
      "ru": "очки"
    },
    "pos": "noun",
    "category": "everyday",
    "level": "A1",
    "source": "Langas"
  },
  {
    "id": "lng_body_001",
    "word": "akis",
    "translations": {
      "en": "eye",
      "ru": "глаз"
    },
    "pos": "noun",
    "gender": "masculine",
    "category": "body",
    "level": "A1",
    "source": "Langas"
  },
  {
    "id": "lng_work_001",
    "word": "alga",
    "translations": {
      "en": "salary",
      "ru": "зарплата"
    },
    "pos": "noun",
    "gender": "feminine",
    "category": "work",
    "level": "A1",
    "source": "Langas"
  },
  {
    "id": "lng_food_002",
    "word": "alus",
    "translations": {
      "en": "beer",
      "ru": "пиво"
    },
    "pos": "noun",
    "gender": "masculine",
    "category": "food",
    "level": "A1",
    "source": "Langas"
  },
  {
    "id": "lng_body_002",
    "word": "amžius",
    "translations": {
      "en": "age",
      "ru": "возраст"
    },
    "pos": "noun",
    "gender": "masculine",
    "category": "body",
    "level": "A1",
    "source": "Langas"
  },
  {
    "id": "lng_time_001",
    "word": "anksti",
    "translations": {
      "en": "early",
      "ru": "рано"
    },
    "pos": "adverb",
    "category": "time",
    "level": "A1",
    "source": "Langas"
  },
  {
    "id": "lng_preposition_001",
    "word": "ant",
    "translations": {
      "en": "on",
      "ru": "на"
    },
    "pos": "preposition",
    "category": "preposition",
    "level": "A1",
    "source": "Langas"
  },
  {
    "id": "lng_time_002",
    "word": "antradienis",
    "translations": {
      "en": "Tuesday",
      "ru": "вторник"
    },
    "pos": "noun",
    "gender": "masculine",
    "category": "time",
    "level": "A1",
    "source": "Langas"
  },
  {
    "id": "lng_family_001",
    "word": "anūkas",
    "translations": {
      "en": "grandson",
      "ru": "внук"
    },
    "pos": "noun",
    "gender": "masculine",
    "category": "family",
    "level": "A1",
    "source": "Langas"
  },
  {
    "id": "lng_family_002",
    "word": "anūkė",
    "translations": {
      "en": "granddaughter",
      "ru": "внучка"
    },
    "pos": "noun",
    "gender": "feminine",
    "category": "family",
    "level": "A1",
    "source": "Langas"
  },
  {
    "id": "lng_preposition_002",
    "word": "apie",
    "translations": {
      "en": "about",
      "ru": "о, про"
    },
    "pos": "preposition",
    "category": "preposition",
    "level": "A1",
    "source": "Langas"
  },
  {
    "id": "lng_clothes_001",
    "word": "apsirengti",
    "translations": {
      "en": "to dress",
      "ru": "одеваться"
    },
    "pos": "verb",
    "category": "clothes",
    "level": "A1",
    "source": "Langas"
  },
  {
    "id": "lng_communication_002",
    "word": "ar",
    "translations": {
      "en": "question word",
      "ru": "ли"
    },
    "pos": "conjunction",
    "category": "communication",
    "level": "A1",
    "source": "Langas"
  },
  {
    "id": "lng_communication_003",
    "word": "arba",
    "translations": {
      "en": "or",
      "ru": "или"
    },
    "pos": "conjunction",
    "category": "communication",
    "level": "A1",
    "source": "Langas"
  },
  {
    "id": "lng_food_003",
    "word": "arbata",
    "translations": {
      "en": "tea",
      "ru": "чай"
    },
    "pos": "noun",
    "gender": "feminine",
    "category": "food",
    "level": "A1",
    "source": "Langas"
  },
  {
    "id": "lng_location_001",
    "word": "arti",
    "translations": {
      "en": "near",
      "ru": "близко"
    },
    "pos": "adverb",
    "category": "location",
    "level": "A1",
    "source": "Langas"
  },
  {
    "id": "lng_communication_004",
    "word": "aš",
    "translations": {
      "en": "I",
      "ru": "я"
    },
    "pos": "pronoun",
    "category": "communication",
    "level": "A1",
    "source": "Langas"
  },
  {
    "id": "lng_movement_001",
    "word": "ateiti",
    "translations": {
      "en": "to come",
      "ru": "приходить"
    },
    "pos": "verb",
    "category": "movement",
    "level": "A1",
    "source": "Langas"
  },
  {
    "id": "lng_event_001",
    "word": "atidarymas",
    "translations": {
      "en": "opening",
      "ru": "открытие"
    },
    "pos": "noun",
    "gender": "masculine",
    "category": "event",
    "level": "A1",
    "source": "Langas"
  },
  {
    "id": "lng_event_002",
    "word": "atidaryti",
    "translations": {
      "en": "to open",
      "ru": "открывать"
    },
    "pos": "verb",
    "category": "event",
    "level": "A1",
    "source": "Langas"
  },
  {
    "id": "lng_work_002",
    "word": "atlyginimas",
    "translations": {
      "en": "salary",
      "ru": "зарплата"
    },
    "pos": "noun",
    "gender": "masculine",
    "category": "work",
    "level": "A1",
    "source": "Langas"
  },
  {
    "id": "lng_event_003",
    "word": "atostogauti",
    "translations": {
      "en": "to have vacation",
      "ru": "быть в отпуске"
    },
    "pos": "verb",
    "category": "event",
    "level": "A1",
    "source": "Langas"
  },
  {
    "id": "lng_event_004",
    "word": "atostogos",
    "translations": {
      "en": "vacation",
      "ru": "отпуск"
    },
    "pos": "noun",
    "category": "event",
    "level": "A1",
    "source": "Langas"
  },
  {
    "id": "lng_appearance_001",
    "word": "atrodyti",
    "translations": {
      "en": "to look like",
      "ru": "выглядеть"
    },
    "pos": "verb",
    "category": "appearance",
    "level": "A1",
    "source": "Langas"
  },
  {
    "id": "lng_communication_005",
    "word": "atsakymas",
    "translations": {
      "en": "answer",
      "ru": "ответ"
    },
    "pos": "noun",
    "gender": "masculine",
    "category": "communication",
    "level": "A1",
    "source": "Langas"
  },
  {
    "id": "lng_communication_006",
    "word": "atsiprašau",
    "translations": {
      "en": "sorry",
      "ru": "извините"
    },
    "pos": "interjection",
    "category": "communication",
    "level": "A1",
    "source": "Langas"
  },
  {
    "id": "lng_event_005",
    "word": "atsitikti",
    "translations": {
      "en": "to happen",
      "ru": "случаться"
    },
    "pos": "verb",
    "category": "event",
    "level": "A1",
    "source": "Langas"
  },
  {
    "id": "lng_movement_002",
    "word": "atvažiuoti",
    "translations": {
      "en": "to come (by transport)",
      "ru": "приезжать"
    },
    "pos": "verb",
    "category": "movement",
    "level": "A1",
    "source": "Langas"
  },
  {
    "id": "lng_communication_007",
    "word": "atvirukas",
    "translations": {
      "en": "postcard",
      "ru": "открытка"
    },
    "pos": "noun",
    "gender": "masculine",
    "category": "communication",
    "level": "A1",
    "source": "Langas"
  },
  {
    "id": "lng_movement_003",
    "word": "atvykti",
    "translations": {
      "en": "to arrive",
      "ru": "прибывать"
    },
    "pos": "verb",
    "category": "movement",
    "level": "A1",
    "source": "Langas"
  },
  {
    "id": "lng_city_002",
    "word": "aukštas",
    "translations": {
      "en": "floor",
      "ru": "этаж"
    },
    "pos": "noun",
    "gender": "masculine",
    "category": "city",
    "level": "A1",
    "source": "Langas"
  },
  {
    "id": "lng_appearance_002",
    "word": "aukštas, -a",
    "translations": {
      "en": "high",
      "ru": "высокий"
    },
    "pos": "adjective",
    "category": "appearance",
    "level": "A1",
    "source": "Langas"
  },
  {
    "id": "lng_appearance_003",
    "word": "aukštis",
    "translations": {
      "en": "height",
      "ru": "высота"
    },
    "pos": "noun",
    "gender": "masculine",
    "category": "appearance",
    "level": "A1",
    "source": "Langas"
  },
  {
    "id": "lng_body_003",
    "word": "ausis",
    "translations": {
      "en": "ear",
      "ru": "ухо"
    },
    "pos": "noun",
    "gender": "masculine",
    "category": "body",
    "level": "A1",
    "source": "Langas"
  },
  {
    "id": "lng_clothes_002",
    "word": "avalynė",
    "translations": {
      "en": "footwear",
      "ru": "обувь"
    },
    "pos": "noun",
    "gender": "feminine",
    "category": "clothes",
    "level": "A1",
    "source": "Langas"
  },
  {
    "id": "lng_clothes_003",
    "word": "avėti",
    "translations": {
      "en": "to wear (shoes)",
      "ru": "носить (обувь)"
    },
    "pos": "verb",
    "category": "clothes",
    "level": "A1",
    "source": "Langas"
  },
  {
    "id": "lng_transport_001",
    "word": "baidarė",
    "translations": {
      "en": "canoe",
      "ru": "байдарка"
    },
    "pos": "noun",
    "gender": "feminine",
    "category": "transport",
    "level": "A1",
    "source": "Langas"
  },
  {
    "id": "lng_event_006",
    "word": "baigiamasis",
    "translations": {
      "en": "final",
      "ru": "финальный"
    },
    "pos": "adjective",
    "category": "event",
    "level": "A1",
    "source": "Langas"
  },
  {
    "id": "lng_event_007",
    "word": "baigtis",
    "translations": {
      "en": "to finish",
      "ru": "заканчиваться"
    },
    "pos": "verb",
    "category": "event",
    "level": "A1",
    "source": "Langas"
  },
  {
    "id": "lng_food_004",